561,0,２０〜２５才,男,94,75,55,33,29,50,40,41,41,61,68,47,40,34,49,78,36,31,61,34,41,32,41,52,47,57,52,21,50,43,35,43,44,46,45,36,60,60,80,60,80,80,80,100,60,60,60,60,40,40,40,60,1,Ｅ,空想癖があり、自分の殻にこもってしまうことがある。それは自己の内面的世界で遊び、美的な生き方をしているあらわれでもある。独自な価値観の持ち主であるといえ、自分を含めて環境を客観的にとらえる傾向が強く、物事をあるがままに把握しようとする。性格的にうつる印象として、やや暗いという感じも受けるが、自分自身について深く内省していて、よく話をしてみると、その豊かな内面性を垣間見ることができる。また、過信することなく、石橋を叩いて渡るような慎重性が本質といえる。思いやりがあり自分をおさえる良さがあるのだが、自分でどうしようもない問題が起こると必要以上に自分の責任を背負い、くよくよと取り越し苦労するといった気弱で引っ込み思案な面もある。神経が細かく過敏なため、人前では緊張してしまうことがあり、快活に振る舞ことをあまり得意としない。そして、気持ちに余裕がなくなってしまうと、多少不安定な行動をとる可能性もある。一般的にはまじめで一途な人に多いが、柔軟性に欠け大らかさがない。,39,15,26,44,30,25,30,46,44,54,46,0
562,0,２０〜２５才,男,42,54,50,51,50,48,44,53,50,57,49,56,50,38,43,62,57,52,51,50,66,50,49,36,59,54,64,48,51,60,55,57,61,56,64,64,80,100,80,60,60,80,80,80,80,80,60,80,80,60,40,40,0,Ｃ,見通しがつくまで動かない慎重さが本質といえる。物事を軽率に判断したり、現実以上に高く評価するようなことも少ない。また、思いやりがあり自分を抑えるよさがあるが、なにか問題が起こると自罰的になり、いつまでもクヨクヨとしてしまう弱気なところもある。控えめな性格であり、自分にできることだけを小さく内々に表現しようとし、失敗したときのことを心配しすぎて、思いきった果敢な行動には移れない。遠慮がちではあるが、病的な暗さというほどではない。また、煩わしい人間関係はできるだけ避けていたいと考えている。どちらかといえば、周囲のことをあれこれと考えるよりも自己の世界に内閉し、その世界をより充実させたいと望み、美的な生き方をしようとしている。なんとなくつかみどころのない漂々とした生活ぶりで、空想癖があったりもする。物事をあるがままに客観的にとらえようとする傾向より、やや主観的に判断することのほうが多い。自分に自信をもち、もう少し図太さなどがあると持ち味の慎重特性がいきてくる。,40,59,54,55,51,54,49,58,53,41,51,0
563,0,２０〜２５才,男,63,48,59,61,50,39,44,48,37,53,51,40,43,26,49,78,57,56,36,50,72,43,61,46,51,54,45,44,47,52,47,54,50,59,67,64,80,80,60,60,100,60,100,80,100,80,80,100,80,80,40,100,-1,Ｃ,状況の変化を敏感にとらえることができ、その環境に適応する能力をそなえた行動派タイプといえる。考えるよりも、まずは身体を動かすことで物事を解決しようとしたり、反面、思索的客観的に検討してから判断する２面性を持っているといえる。情緒的にも安定しており、自分なりのリズムをもって生活をしている。手掛けた仕事を途中で放り出すような無責任さは少ない。発想も思い付きばかりではなく、理詰めで堅実なところもあり、非常にユニークなアイデアを出すことがある。感覚的に判断するのではなく、客観的に物事を把握し行動している。また、社会への関心もあり世間に対する配慮もみられる。どちらかといえば、進んでたくさんの交友関係を形成するというより、気の許せる限られた友人との付き合いを大切にするところがある。常に自分を一歩外に置き、人情や感情に左右されない発言をすることがあるため、冷たいという印象を他人に与えてしまうことがあるが、実のところ自身を深く内省していて、豊かな内面性の持ち主といえる。,45,46,42,50,51,50,47,51,46,46,51,0
564,0,２０〜２５才,女,65,38,42,49,42,59,48,38,45,61,46,52,47,30,52,62,57,70,71,53,56,59,49,58,42,33,45,54,39,38,58,61,57,52,56,61,80,100,80,100,100,40,80,60,60,40,80,60,40,80,20,60,16,Ｂ,他の人がなんと言おうと自分で確信がもてるまで、決して行動には移さない慎重なところがある。軽はずみな行動は少なく、落ち着いた雰囲気と信頼感がある。また、努力を信条とし、何事も丹念に取り組んでいこうとする。出だしはそれほどでもないが、いつまでも持続させることができる。生活ぶりもキチンとしていて、物事は計画書を書いて実行するようなマメな人である。しかし、あくまでも一つのことに執着する頑固さではなく融通性も持っている。それほど規則や秩序を気にするわけでなく、状況に応じた判断ができる。世間の常識はわきまえていても、四角四面で固定的なものでなく、よき社会人として模範的な見方をされる。しかし、慎重であるがゆえ、問題が起こると必要以上に自分を責めることがある。その後は二度と同じ失敗をしないように考えすぎて、行動は控えめになることがある。もう少し、図太さがあり積極的にうってでるところがあると安心して見ていられるリーダーになる。しかし、手堅さや慎重さなど評価できる部分は多い。,74,51,44,65,75,52,60,52,59,52,56,0
565,0,２０〜２５才,男,60,48,63,49,38,59,48,68,58,57,51,43,60,60,32,53,57,52,55,53,62,55,53,43,57,47,52,54,60,57,52,54,61,52,60,54,100,100,100,80,80,100,100,60,100,100,100,100,100,100,100,80,5,Ｃ,自己顕示欲が強く、目立ちたがりで勝気なところがある。批判されると感情的になることもあるが、その対立意見にムキになりすぎて、自分のリズムを崩してしまうことがある。また、喜怒哀楽などの表情が激しく、感情を表に出したり、反面、感情を抑えたように何事にも動じない冷静なときの２面性がある。感情的であるときと、理性的であるときとが交互にでる。そして、自分が評価されていると感じることが、最大の満足とするところがあり、プライドを傷つけられないように注意をはらっている。どちらかといえば、広く浅い交友関係をもつことよりも、限られた友人との深い交友関係を大切にしている。社会への関心はあり、世間に対する配慮もみられ、時として非常にユニークなアイデアを出すこともある。しかし、あまり関係のない相手には、人情的にのめり込むようなことがなく、一歩外から物事を眺めようとし、冷静な態度で客観的な判断をしようとする。そのためか冷たいとの印象を与えがちだが、内面は豊かで、自己を深く内省している。,54,58,53,54,46,68,50,56,56,43,56,0
566,0,２０〜２５才,男,61,68,50,30,38,42,40,48,45,61,46,33,57,26,52,78,36,26,46,41,41,36,45,39,54,47,39,33,45,41,38,35,38,46,41,30,20,80,60,40,60,80,80,60,80,40,60,60,60,60,60,60,-1,Ｅ,周囲の雑音をあまり気にせず、ときに時間を忘れたように何かを空想しているような傾向が見られる。内面的な世界の中で自己表現をすることで、喜びを感じているようである。そして、自らが進んで行動することは少ないものの、情報の収集のためのアンテナは用意している。物事の把握のしかたは客観的であり、結果と経過の両方を大切にする。自分自身についても深く内省していて、客体化した態度をとろうとする。そのためか、人から見ると本音がわかりづらいという印象があり、多少、冷たい感じを受けることがあるが、実のところ、思いやりや自分の感情を抑える良さがあり、豊かな内面性をそなえている。また、明確な見通しがつくまで動かないという慎重なところもある。しかし、その慎重性は、自分の理想があるのに対して、無理のないところで妥協してしまうこともあり、善し悪しというところである。大きな失敗をしないことはひとつの取り柄ではあるが、あれこれと考えすぎる前に、もう少し思いきった行動をとるような姿勢がほしい。,29,15,18,37,25,24,35,41,43,50,47,0
567,0,２０〜２５才,男,81,45,50,61,38,75,63,38,32,57,42,36,67,50,40,46,64,70,71,59,62,67,61,65,39,30,60,65,45,46,71,68,79,49,64,66,100,100,100,100,80,100,100,100,100,100,80,80,80,80,80,100,26,Ａ,コツコツと几帳面な人。生活ぶりもキチンとしていて、丹念な仕事ぶりである。スタ−ト・ダッシュはそれほどではないが、息切れがせずいつまでも走りつづける長距離ランナ−型でもある。徹底性もみられ、それがときにはしつこさに映じることもある。世間のきまりや常識を大切にして、ものごとの判断は杓子定規になりがちである。堅物との印象があり、その意見やアイデアは手堅いものの斬新さや柔軟さに欠けるきらいがある。大きな失敗をしないことがこの人の取り柄といえる。,86,71,59,76,86,72,61,62,69,56,66,0
568,0,２０〜２５才,男,74,35,29,54,59,66,51,38,58,53,42,43,50,30,52,53,62,61,61,50,44,59,45,55,39,38,60,54,60,50,58,47,53,39,41,54,100,100,100,80,100,100,100,80,40,40,40,60,40,100,80,80,6,Ｃ,ひとつひとつを丹念に片付けていこうとする傾向がある。どちらかというと尻上がりに熱がこもってきて、夢中になると他のことに目がいかなくなる。徹底性があるといっても、あくまでもひとつのことに固執して、必要以上に堀り下げていくというほどではない。また、自分らしさを積極的に前面に出して、主張すべき事は主張するというより、自分の生きている環境の中で、周囲が自分をどう見ているかというほうを気にする。しかし、自分の信念に基づいた行動体系はしっかりともっていて、状況に応じた判断をすることができる。この主性格をもつ人は、世間の常識や規則を強く気にするあまり、定型的になってしまうことが多いが、頑固さだけではなくわりと融通性もある。発想もユニークで杓子定規な固定的なものではない。一方では、瞬発力もあり持続力もあるが、感情の起伏が激しい面があり、元気に張り切っている時と落ち込んでちんまりしている時との気分の落差がハッキリと見分けられる。しかし、人間的には温かい所があり世話好きである。,66,47,42,48,58,48,62,51,60,55,50,0
569,0,２０〜２５才,女,38,58,63,46,59,59,44,61,71,69,42,62,50,57,26,50,62,48,51,56,62,43,41,43,68,54,68,54,68,73,47,64,65,63,56,54,100,100,100,100,100,100,100,100,100,80,100,100,100,100,80,80,-6,Ｃ,困難に遭遇しても、あきらめることなく、積極的に外にうって出ることで問題解決をはかろうとする勝気な性格である。しかし、過信せず見通しがつくまで動かないという慎重さも持ち合わせているため、ただやみくもに行動したり、やぶれかぶれになったりすることは少ない。人によっては、感情的に動いている印象にもとれるが、物事を本格的に実行するときは、時間をかけてもじっくりと頭の中で整理し、ある程度の予測をつけてから行動する。過去の経験なども参考にする。ただし、自分にとってどうでもよいことや、細かいこと、または、プライドを傷つけられるようなことには、感情的になり、場の雰囲気に左右されがちである。競争心が強いため、ライバルがいると実力以上の成果をみせることもある。理論的には両特性は別な人格といえ、ひとつでは存在しないタイプである。日によって積極性の面と慎重性の面とが交互にあらわれる感じで、自分自身にとって完全な体制ができているときに、両側面の良さの特性がかみ合い、能力を発揮できる。,40,67,64,56,42,66,44,59,59,37,49,0
570,0,２０〜２５才,男,41,45,50,58,42,39,32,55,50,78,59,36,70,38,52,41,57,65,51,47,69,40,49,50,65,57,39,58,57,60,38,43,44,63,64,52,80,100,100,100,100,100,100,80,100,80,80,100,100,100,60,80,0,Ｄ,過信せず、見通しがつくまで動かない慎重さがこの人の本質である。思いやりがあり、自分をおさえる良さがあるが、問題がおこると自罰的傾向をとり、くよくよと取り越し苦労する面も。気弱で引っ込み思案の人である。自分に自信がなく、快活な面がみられない。神経が細かく過敏な性格で、人前では緊張してかたくなりがちである。余裕がなくなると、多少不安定な行動をとる可能性もでる。一般的にはまじめで一途な人が多いが、柔軟性に欠けおおらかさがない。,39,49,51,39,37,53,53,50,46,41,48,0
571,0,２０〜２５才,女,78,61,38,36,42,72,55,41,32,81,54,50,47,42,52,50,43,44,76,50,50,50,53,58,42,44,52,41,47,50,58,50,72,42,45,44,60,100,100,80,60,80,80,60,80,60,40,80,60,80,80,60,19,Ｃ,他の人がなんと言おうと自分で確信がもてるまで、決して行動には移さない慎重なところがある。軽はずみな行動は少なく、落ち着いた雰囲気と信頼感がある。また、努力を信条とし、何事も丹念に取り組んでいこうとする。出だしはそれほどでもないが、いつまでも持続させることができる。生活ぶりもキチンとしていて、物事は計画書を書いて実行するようなマメな人である。しかし、あくまでも一つのことに執着する頑固さではなく融通性も持っている。それほど規則や秩序を気にするわけでなく、状況に応じた判断ができる。世間の常識はわきまえていても、四角四面で固定的なものでなく、よき社会人として模範的な見方をされる。しかし、慎重であるがゆえ、問題が起こると必要以上に自分を責めることがある。その後は二度と同じ失敗をしないように考えすぎて、行動は控えめになることがある。もう少し、図太さがあり積極的にうってでるところがあると安心して見ていられるリーダーになる。しかし、手堅さや慎重さなど評価できる部分は多い。,70,35,35,59,57,34,47,54,61,59,57,0
572,0,２０〜２５才,男,29,58,59,43,54,45,40,55,45,73,51,66,53,38,49,36,55,52,46,53,62,47,53,50,47,57,64,41,51,60,44,57,50,39,60,52,80,100,80,100,100,100,100,60,100,60,60,80,40,80,20,40,0,Ｄ,あくまでも先が見えるまで動かず、容易な決断はしないような慎重さが身上といえる。自分の感情を抑え、人にもやさしいといえるが、問題が起こると自罰的になったり、過去の失敗をいつまでも悩んだりする傾向がみられる。また、何をやらせても着実で手堅い人である。慎重すぎるせいか、発想は着実であり非常にユニークなアイデアや意見をもっているが、大胆な行動などはあまりとらないため、できることだけを小さくまとめて控えめに表現することがある。遠慮がちであり、もう少し視野を広げ、図太さなどがそなわると良い特性が引き出せる。また、どちらかといえば、たくさんの人が集まるところでは、自分から積極的に話しかける社交家ではないが、社会へ関心はあり、情報を収集するアンテナはしっかりと張りめぐらせている。物事を客観的にとらえようとする傾向がつよく、キチンと把握しようとする姿勢がみられる。あまり人情的にのめりこまないため冷たい印象を与えがちだが、豊かな内面性の持ち主で、自分自身を深く内省している。,38,41,47,43,43,46,44,54,49,51,49,0
573,0,２０〜２５才,女,61,54,50,51,59,59,55,48,45,73,65,50,40,50,46,70,46,48,55,41,50,63,36,55,47,57,55,54,50,48,55,61,48,46,52,54,80,100,100,60,60,80,100,80,100,40,60,40,60,60,20,60,2,Ｃ,過信せず、見通しがつくまで動かない慎重さがこの人の本質である。思いやりがあり、自分をおさえる良さがあるが、問題がおこると自罰的傾向をとり、くよくよと取り越し苦労する面も。気弱で引っ込み思案の人である。自分に自信がなく、快活な面がみられない。神経が細かく過敏な性格で、人前では緊張してかたくなりがちである。余裕がなくなると、多少不安定な行動をとる可能性もでる。一般的にはまじめで一途な人が多いが、柔軟性に欠けおおらかさがない。,66,43,47,58,57,40,52,47,48,53,41,0
574,0,２０〜２５才,男,80,71,71,39,42,63,51,59,53,50,46,40,60,46,40,46,52,35,51,59,53,43,61,36,50,38,45,44,45,55,47,47,53,52,52,44,80,100,100,80,60,80,60,100,80,80,80,80,80,100,80,80,4,Ｄ,自分の世界を大事にして、外界のことに興味がうすい。他人と接触することが面倒であり、交友関係なども進んで持とうとはしない。審美的な生きかたをしていて、自分の信じる価値観のなかで生活している。交友関係は狭いが、つきあいはじめれば深くなる。自分もふくめて環境をあるがままに客観的にとらえようとする傾向がつよく、ものごとをキチンと把握しようとする。人情的にのめりこまず、冷たい印象を他人に与えることがあるが、自分自身について深く内省しているといえ、豊かな内面性をもつ。,42,37,37,49,33,48,36,52,54,45,58,0
575,0,２０〜２５才,男,80,48,59,61,50,63,51,48,37,61,51,50,50,38,49,58,59,48,61,63,53,63,57,50,47,57,60,58,57,65,50,73,76,42,49,66,80,100,100,80,80,60,100,100,80,80,80,100,80,60,40,80,11,Ｂ,努力を信条とし、目標に向けて一生懸命に励む性格である。手掛けた事は丁寧に処理しキチンとしている。途中であきらめてしまうことは少なく、物事には粘り強く取り組んでいく忍耐力もある。見方によっては、それが執念深さとしてうつることもある。そして、独自の価値観にそった判断をしているが、発想は堅苦しいものばかりではなく、ユニークさも持ちあわせている。自分の考えはあらかじめ用意しているが、いろいろな計画を立てるときは、自分だけの勝手な判断で決定するのではなく、他人の意見も取入れながら考えていこうとする。また、身が軽く体を動かして物事を解決していくところもある。だからといって、思いついたら何も考えずに即実行といった軽薄さや、気分で行動したりすることは少ないため大きな失敗はあまりない。新しい環境の変化にもそれほど時間をかけずに適応することができる。場や雰囲気にのまれることなく、精神的にも安定している。まれに感情的になってしまうこともあるが、人情もろくてお人好しな性格である。,61,66,72,63,59,73,52,63,61,55,57,0
576,0,２０〜２５才,男,61,54,42,46,47,59,51,44,37,57,65,47,57,38,55,46,46,52,61,47,47,55,49,55,50,54,45,54,45,50,41,54,53,49,49,52,60,80,80,80,40,60,100,40,80,20,80,20,60,60,40,60,7,Ｃ,時期尚早なことは決してせず、あくまでも機が熟すのを待つような慎重さがある。自分の感情を抑えるよさがあり、人に対する気配りもみられる。しかし、他人の思惑を考えすぎたり、行動する前から問題が起こることを予測するような気の弱さを表に出すことがあり、そうしたことも見方によっては、自信のなさからきているものだと誤解をまねくことがある。もともと、過敏な神経の持ち主であり、大勢の人の集まる場所では、緊張のため快活に振舞えなくなることがある。持っている冷静さを失うと、不安定な行動をとる可能性もある。一般的に真面目で一途な人に多いが、もう少し精神的に余裕をもてるような、おおらかさがほしい。また、任されたことは単純な作業であっても、飽きずに長時間こなせる持続性がある。通常は何事もコツコツと丹念に取り組むほうで、生活ぶりも規則正しく、几帳面である。努力を信条とし、いつまでも走り続ける長距離ランナー型といえる。しかし、一時に没頭しすぎるきらいがあり、しつこさとして映ることもある。,60,41,46,55,56,42,53,50,50,54,49,0
577,0,２０〜２５才,男,41,58,50,46,29,66,51,48,45,61,37,40,57,42,43,62,52,44,61,56,41,36,49,43,57,36,64,37,50,55,55,54,53,52,38,50,80,80,100,60,80,20,60,100,60,80,80,100,100,60,60,60,10,Ｃ,単調な作業であっても、飽きずに長時間こなせる持続性がある。努力と忍耐をもって、目標に向かっていくといった傾向がある。一事に没頭する徹底性がみられ、人からはそれがしつこいと思われることもあるほどで、夢中になると他のことには目がいかなくなるところがある。几帳面だが、ガンコで堅物との印象もあり、社会の秩序を乱す行動は慎み、通俗的な道徳観の持ち主で、物事の判断もそれに沿ったものになる。とはいえ、規則やしきたりにこだわりすぎるというわけではなく、いつも普通の人でありたいと思う願望が常識的な行動をとらせている。また、状況を鵜呑みにせず、先が見えるまでアクションを起こさないという慎重さも本質のひとつである。感情を抑え、落ち着いた雰囲気で信頼される。しかし、問題が起こったりすると、小さなミスでもいつまでも気にかけたり、他の人はとっくに忘れてしまうような失敗を、いつまでも忘れられず悩んだりするところもある。できることだけを小さくまとめるため、思いきった積極的な行動はしない。,46,42,39,59,39,52,41,58,59,50,58,0
578,0,２０〜２５才,男,50,65,55,43,42,66,58,38,50,65,46,56,43,53,40,53,44,56,66,50,56,52,49,55,36,41,75,48,36,46,55,68,61,35,60,52,40,100,80,80,80,100,80,80,80,80,80,100,100,100,20,40,16,Ｂ,几帳面で、生活ぶりもキチンとしている。努力を信条として、地道に自分らしい事を息切れがせずいつまでも丹念に続けるタイプの人である。徹底性もみられ、納得がいくまで手掛けたことを大事にする。そして常識家でもあり、世間から逸脱した行動をとることはない。いわば万事手堅く安全にという生き方といえるが、斬新さや柔軟さに欠ける。しかし、頭の中にはアイデアがたくさんつまっていて、凝り性なところもある。ただ、内面で素晴らしい発案や考えがあっても、それを他人にうまく表現し伝えるとなると堅苦しくなってしまう。また、どちらかというと美的な生き方をしているといえる。他人と交友関係を進んでもつことは少ないものの、自己の考えや価値観の合う人は大切にしている。しかし、生活のためか、情報収集のために必要な社会的アンテナは張っている。ものの見方は自分も含め客観的で、物事をキチンと把握しようとしている。そのためか、常に一歩外からの発言が多く、冷たいとの印象を与えがちだが内面性は非常に豊かである。,75,46,42,69,73,49,47,57,58,54,55,0
