826,0,２０〜２５才,男,100,48,42,64,42,66,51,41,37,57,57,47,47,30,61,58,46,44,55,44,47,47,41,65,36,47,64,41,54,38,55,64,61,31,45,57,80,80,100,80,80,60,100,80,80,40,40,60,60,40,40,60,16,Ｂ,努力を信条とし、目標に向けて一生懸命に励む性格である。手掛けた事は丁寧に処理しキチンとしている。途中であきらめてしまうことは少なく、物事には粘り強く取り組んでいく忍耐力もある。見方によっては、それが執念深さとしてうつることもある。そして、独自の価値観にそった判断をしているが、発想は堅苦しいものばかりではなく、ユニークさも持ちあわせている。自分の考えはあらかじめ用意しているが、いろいろな計画を立てるときは、自分だけの勝手な判断で決定するのではなく、他人の意見も取入れながら考えていこうとする。また、身が軽く体を動かして物事を解決していくところもある。だからといって、思いついたら何も考えずに即実行といった軽薄さや、気分で行動したりすることは少ないため大きな失敗はあまりない。新しい環境の変化にもそれほど時間をかけずに適応することができる。場や雰囲気にのまれることなく、精神的にも安定している。まれに感情的になってしまうこともあるが、人情もろくてお人好しな性格である。,69,46,48,62,64,50,48,53,54,63,51,0
827,0,２０〜２５才,女,64,54,50,51,47,69,55,50,50,78,54,43,57,50,46,50,50,48,66,50,56,55,49,50,51,51,64,51,50,57,64,73,57,56,52,61,80,100,100,80,80,100,100,80,100,80,40,80,80,100,20,60,7,Ｂ,他の人がなんと言おうと自分で確信がもてるまで、決して行動には移さない慎重なところがある。軽はずみな行動は少なく、落ち着いた雰囲気と信頼感がある。また、努力を信条とし、何事も丹念に取り組んでいこうとする。出だしはそれほどでもないが、いつまでも持続させることができる。生活ぶりもキチンとしていて、物事は計画書を書いて実行するようなマメな人である。しかし、あくまでも一つのことに執着する頑固さではなく融通性も持っている。それほど規則や秩序を気にするわけでなく、状況に応じた判断ができる。世間の常識はわきまえていても、四角四面で固定的なものでなく、よき社会人として模範的な見方をされる。しかし、慎重であるがゆえ、問題が起こると必要以上に自分を責めることがある。その後は二度と同じ失敗をしないように考えすぎて、行動は控えめになることがある。もう少し、図太さがあり積極的にうってでるところがあると安心して見ていられるリーダーになる。しかし、手堅さや慎重さなど評価できる部分は多い。,64,66,58,66,64,60,50,57,57,48,51,0
828,0,２０〜２５才,男,89,51,47,49,63,39,44,55,58,34,46,43,43,22,52,74,59,48,42,56,59,55,49,50,51,47,49,58,66,57,41,43,48,49,60,54,80,80,60,60,60,100,100,80,80,80,80,60,80,80,60,60,-8,Ｄ,ひらめきや思い付きが早く行動的であったかと思えば、急に静かにちんまりとしているというように、調子の良いときと悪いときに差があり、気分や感情に起伏がある。また、物事は細かいことより、全体をながめて調和がとれているかを気にするほうで、ひとつのことにいつまでもこだわるという徹底性はあまりみられない。いったん夢中になると他のことに目がいかなくなることがあり、一方では何でも飛びつき自分なりに納得がいくとあっさりと放り出してしまう２面性がある。次々と興味を抱くものがあり、本人自身は退屈しない。そして、感情を表に出すほうで、喜怒哀楽が激しく、いやなことがあっても回復力は比較的はやい。気立てがよくお人好しなためか、おだてには弱く褒められるとついその気になってしまうところもあり、周囲から親しまれることもある。しかし、内面は負けず嫌いで、常に周囲からの評価を気にかけていて、自尊心を満たそうとしているが、他人とは競争関係にあるより、できるだけうまくやっていきたいと望んでいる。,33,42,44,26,31,41,52,50,48,46,48,0
829,0,２０〜２５才,男,80,38,50,58,50,45,32,32,45,47,57,47,50,46,46,62,46,61,42,34,44,59,36,43,42,59,43,48,50,43,28,50,42,42,45,50,60,80,80,60,60,60,60,60,40,80,80,80,60,60,40,100,-3,Ｅ,行動的であり、常に体を動かして物事に取り組んでいく。環境が変わってもあまり時間をかけずにとけ込むことができ、状況判断も的確にすることができる。また、情緒的にもわりと安定していて、発想も感覚的なとらえ方ばかりでなく、理論的な考え方もできる。自分なりのリズムをもって生活し、物事を途中で放り出すような気分屋的な面はないが、たくさんのことに興味をしめすことがあり、どれもこれもとかかえるとまとまりがつかなくなることがある。反面、弱気になったり、自分に自信がなくなったりすることもある。テキパキと活動的で何事も平気なのかと思うと、人前では緊張し、余裕がなくなると多少不安定な行動をとってしまう可能性があったりもする。また、自分にあせりが生じたり、失敗に対する不安感をもちはじめると、これを克服しようとイライラ状態になってしまい、気負いと劣等感でギグシャクする。神経が細かく敏感であり、真面目で一途だといえる。本来２つの主性格をもち、１つでは存在しないタイプの性格と考えられる。,41,21,33,34,40,26,56,43,43,53,40,0
830,0,５６才以上,男,38,51,55,49,42,72,55,53,37,61,57,29,57,34,58,58,59,65,61,53,69,55,49,55,54,50,68,54,66,57,55,68,68,49,64,66,80,100,80,100,80,80,100,60,100,60,40,60,80,80,100,60,12,Ａ,仕事にも生活にも几帳面で、キチンとしていなければ気がすまないタイプである。手掛け始めたことは、地道にコツコツと努力し、途中で投げ出すことなく最後までやりぬこうとする。徹底性もあり、ときにそれがしつこいという印象になる。常識からはずれた行動をとることなく、あくまでも社会規範に沿った生活を重んじている。そのため杓子定規な判断も多く、斬新さや柔軟さに欠けるきらいがあるが、大きな失敗をしないことは取り柄といえる。また、過信せずある程度の見通しがつくまで行動しない慎重さもある。他人の意見なども自分が納得するまでは、簡単に受け入れることはあまりない。状況の変化に対しては、徹底的に理由を調べてから次の行動へ移ろうとする。そして、自分と他人を比べて考えるようなことはなく、他人には思いやりをもって接しようとしている。よくいえば、自分を抑える良さととれるが、一方では気弱で引っ込み思案であり快活な面がないともいえる。努力型と慎重性、弱気さをもった神経の細かい過敏な性格である。,76,67,61,77,70,70,53,61,60,50,55,0
831,0,５６才以上,男,38,51,55,49,42,72,55,53,37,61,57,29,57,34,58,58,59,65,61,53,69,55,49,55,54,50,68,54,66,57,55,68,68,49,64,66,80,100,80,100,80,80,100,60,100,60,40,60,80,80,100,60,12,Ａ,仕事にも生活にも几帳面で、キチンとしていなければ気がすまないタイプである。手掛け始めたことは、地道にコツコツと努力し、途中で投げ出すことなく最後までやりぬこうとする。徹底性もあり、ときにそれがしつこいという印象になる。常識からはずれた行動をとることなく、あくまでも社会規範に沿った生活を重んじている。そのため杓子定規な判断も多く、斬新さや柔軟さに欠けるきらいがあるが、大きな失敗をしないことは取り柄といえる。また、過信せずある程度の見通しがつくまで行動しない慎重さもある。他人の意見なども自分が納得するまでは、簡単に受け入れることはあまりない。状況の変化に対しては、徹底的に理由を調べてから次の行動へ移ろうとする。そして、自分と他人を比べて考えるようなことはなく、他人には思いやりをもって接しようとしている。よくいえば、自分を抑える良さととれるが、一方では気弱で引っ込み思案であり快活な面がないともいえる。努力型と慎重性、弱気さをもった神経の細かい過敏な性格である。,76,67,61,77,70,70,53,61,60,50,55,0
832,0,２０〜２５才,女,66,35,63,58,33,78,51,44,41,65,54,59,40,50,43,53,64,65,76,50,62,55,49,50,47,51,55,62,51,60,68,68,50,49,56,54,100,100,100,100,80,80,80,80,60,80,60,100,80,80,60,80,14,Ｂ,単調な作業であっても、飽きずに長時間こなせる持続性がある。努力と忍耐をもって、目標に向かっていくといった傾向がある。一事に没頭する徹底性がみられ、人からはそれがしつこいと思われることもあるほどで、夢中になると他のことには目がいかなくなるところがある。几帳面だが、ガンコで堅物との印象もあり、社会の秩序を乱す行動は慎み、通俗的な道徳観の持ち主で、物事の判断もそれに沿ったものになる。とはいえ、規則やしきたりにこだわりすぎるというわけではなく、いつも普通の人でありたいと思う願望が常識的な行動をとらせている。また、状況を鵜呑みにせず、先が見えるまでアクションを起こさないという慎重さも本質のひとつである。感情を抑え、落ち着いた雰囲気で信頼される。しかし、問題が起こったりすると、小さなミスでもいつまでも気にかけたり、他の人はとっくに忘れてしまうような失敗を、いつまでも忘れられず悩んだりするところもある。できることだけを小さくまとめるため、思いきった積極的な行動はしない。,71,56,60,57,74,65,56,56,62,51,53,0
833,0,２０〜２５才,女,82,45,42,61,54,53,40,59,50,50,46,40,47,22,52,78,66,56,61,53,66,55,45,46,59,41,68,51,60,46,44,50,65,52,60,69,100,100,100,100,80,100,100,20,100,60,60,60,60,60,40,60,7,Ｃ,いつも活発に体を動かし、テキパキした行動で物事を解決していく人。身軽であり思いたった事は素早く実行に移すことができる。状況の変化にたやすくついていくことができ、実際的な活動場面に向いている。行動的ではあるが、情緒的にも安定し自分なりのリズムをもって生活をしている。手掛けた事を途中で放り出すといった気分屋なところは少なく、感覚的ではあるが、理詰めな考え方もできる。また、困難に直面すると外にうってでる外向的な人で、他者と競合させると実力以上の成果をあげることができる。そして、自分が主張したいことがあれば、先輩であろうと上司であろうと対等な議論、話し合いをする。そうした行為も、一見すると独善的に見えるが、自分だけが偉いといった思いあがりではない。協調性もあり、周囲への配慮をするなど世慣れたところもしっかりとそなえている。ややプライドが高く勝気な傾向も認められ、対人関係できつくなることもあるが、対外的には非常に頼りになり、慎重性と計画性があれば有能な人材といえる。,51,59,54,49,51,65,55,57,59,45,53,0
834,0,２０〜２５才,男,50,58,50,46,59,59,55,53,53,90,74,40,47,22,75,50,43,52,61,31,53,59,23,52,50,76,43,58,50,55,58,64,42,49,45,47,60,100,100,100,100,80,80,40,60,80,40,80,80,100,40,40,-3,Ｃ,過信せず、見通しがつくまで動かない慎重さがこの人の本質である。思いやりがあり、自分をおさえる良さがあるが、問題がおこると自罰的傾向をとり、くよくよと取り越し苦労する面も。気弱で引っ込み思案の人である。自分に自信がなく、快活な面がみられない。神経が細かく過敏な性格で、人前では緊張してかたくなりがちである。余裕がなくなると、多少不安定な行動をとる可能性もでる。一般的にはまじめで一途な人が多いが、柔軟性に欠けおおらかさがない。,64,42,50,48,53,34,52,43,46,51,32,0
835,0,２０〜２５才,男,50,58,50,46,59,59,55,53,53,90,74,40,47,22,75,50,43,52,61,31,53,59,23,52,50,76,43,58,50,55,58,64,42,49,45,47,60,100,100,100,100,80,80,40,60,80,40,80,80,100,40,40,-3,Ｃ,過信せず、見通しがつくまで動かない慎重さがこの人の本質である。思いやりがあり、自分をおさえる良さがあるが、問題がおこると自罰的傾向をとり、くよくよと取り越し苦労する面も。気弱で引っ込み思案の人である。自分に自信がなく、快活な面がみられない。神経が細かく過敏な性格で、人前では緊張してかたくなりがちである。余裕がなくなると、多少不安定な行動をとる可能性もでる。一般的にはまじめで一途な人が多いが、柔軟性に欠けおおらかさがない。,64,42,50,48,53,34,52,43,46,51,32,0
836,0,２０〜２５才,女,100,31,59,58,63,23,19,71,84,26,28,56,50,34,43,53,71,65,16,73,76,52,45,32,76,28,39,62,74,70,18,35,44,82,67,61,100,100,60,100,100,100,100,100,100,100,60,100,100,100,20,20,-25,Ｃ,困難に遭遇したときは他に働きかけ、外にうってでる外向的な人。積極性があるといえるが、他罰的傾向もみられる。競争心がつよくて、他者と競合させると実力以上の成果をみせることもある。自己顕示欲があり、目立ちたがり。勝気な性格である。気位いが高く、自分が評価されていると感じることが最大の満足。一人よがりな面がみられ、自尊心を満たすことで生きている。プライドを傷つけられないよう細心の注意をはらう。またおだてに乗せられやすく、ちょっと褒めてやるとその気になってしまう。,27,60,61,35,42,61,57,54,45,24,54,0
837,0,２０〜２５才,男,82,45,55,64,47,56,44,53,27,57,51,52,60,73,29,58,57,65,61,70,59,59,70,55,54,54,75,51,62,63,55,77,76,52,64,69,100,100,100,80,80,100,100,80,80,60,80,80,80,80,40,80,12,Ａ,行動的であり、思い付いたことは素早く実行する。環境への適応力があり、状況の変化にもたやすくついていける。やや思索性に欠けるきらいがあるが、実際的な活動には向いている。行動的ではあるが情緒的にも安定しており、一定のリズムをもって生活をしている。また、手掛けはじめたことを途中で放り出すような気分屋的な所はあまり見られない。やや感覚的といえるが、発想も思い付きばかりではない。筋道をたてた理詰めな考え方をすることができる。一方では、過信せず見通しがつくまで動かないという慎重さも本質のひとつである。思いやりがあり自分を抑えるよさがあるが、問題が起こるとあっさりと流してしまうときと、責任を一人で感じ、いつまでもとりこし苦労をしてしまう気弱な面とが交互にあらわれたりする。行動的なときはよいが、慎重すぎると自分のできることだけを内々に小さく表現しようとする傾向があり、失敗を恐れるあまり果敢にうってでることができない。しかし、病的な暗さはなく、手堅さは評価することができる。,69,76,62,78,72,79,55,67,59,51,63,0
838,0,２０〜２５才,女,50,71,38,33,50,50,44,53,53,47,33,40,33,26,52,87,49,44,42,50,44,40,49,58,42,36,49,41,51,46,41,64,48,39,45,42,80,60,40,40,60,60,80,60,80,40,20,60,80,40,40,40,1,Ｅ,自己の世界を繰りひろげることに強い関心があり、周囲のことに対してあまり興味がなくなってしまうといったことがある。交友関係も自ら進んで持とうとはしない。どちらかといえば、行動的というよりも、一人静かに落ち着いているほうを好んでいるのだが、にぎやかな場所や人混みに拒絶的というほどでもない。タテマエか本音かがハッキリと区別がつかないため、少しわかりづらいという印象を他人に与えることもあるが、自己の内面のなかで美的な生き方をしているといえる。物事の判断は客観的にみようとする傾向よりも、主観的に判断することの方が多いのだが、それは、場の雰囲気や感情に左右されるような人間臭さともいえる。また、他人の言葉や行動などを気にすることがあり、自分と他人を比較してしまう傾向がある。一方では、積極的に物事に取り組み、たとえ困難に遭遇しても他に働きかけ、解決しようとする面もある。精神的には独立していて、他に依存することを嫌う。また、他人からの押し付けがましさは、あまり望んでいない。,39,21,27,33,33,21,43,47,51,55,52,0
839,0,２０〜２５才,女,78,41,59,54,33,39,36,55,45,50,46,33,50,46,35,87,57,48,51,56,56,40,61,36,57,44,49,48,45,48,38,31,44,56,45,50,100,100,60,40,80,80,60,60,60,60,80,60,60,80,80,100,4,Ｄ,自分の内面的世界で独自な価値観を形成し、自分自身を深く見つめていて、発想やアイデアにはセンスのよさを感じさせる。また、たくさんの交友関係を望んでいるわけではないが、気の合う友人とは深い付き合いをしていて、他人など周囲への配慮もみられるという社会性をそなえている。そして、冷静かつ的確な判断をしようとしていて、客観的なものの見方をしている。ときに、その客観的すぎる判断や意見について、冷たいとの印象を他人に与えてしまうことがあるが、そこに他人を見下したり冷笑するような発言がない限り、おおきな障害になることはない。物事の取り組み方は、内容と結果を検討しながら、加えて他人と比較しながら、自分が評価されることが重要と考えることがある。多少、勝気な性格といえ、他人と競合するような場面では実力以上の結果を生み出すことがある。精神的には独立していて、他人に依存したり、押しつけがましさは好むところではない。思いあがった独善性もなく対外的には頼りになるが、他罰的傾向もみられる。,34,42,44,42,34,55,47,52,49,46,56,0
840,0,２０〜２５才,女,100,45,47,64,47,72,40,53,45,50,39,50,40,26,49,70,57,52,61,56,53,55,45,39,54,38,60,48,60,60,44,68,57,56,49,64,100,100,100,40,40,60,60,60,60,60,80,80,80,80,20,60,6,Ｂ,努力を信条とし、目標に向けて一生懸命に励む性格である。手掛けた事は丁寧に処理しキチンとしている。途中であきらめてしまうことは少なく、物事には粘り強く取り組んでいく忍耐力もある。見方によっては、それが執念深さとしてうつることもある。そして、独自の価値観にそった判断をしているが、発想は堅苦しいものばかりではなく、ユニークさも持ちあわせている。自分の考えはあらかじめ用意しているが、いろいろな計画を立てるときは、自分だけの勝手な判断で決定するのではなく、他人の意見も取入れながら考えていこうとする。また、身が軽く体を動かして物事を解決していくところもある。だからといって、思いついたら何も考えずに即実行といった軽薄さや、気分で行動したりすることは少ないため大きな失敗はあまりない。新しい環境の変化にもそれほど時間をかけずに適応することができる。場や雰囲気にのまれることなく、精神的にも安定している。まれに感情的になってしまうこともあるが、人情もろくてお人好しな性格である。,50,66,69,56,49,66,52,58,61,47,54,0
841,0,２０〜２５才,男,73,68,63,39,47,56,63,55,45,69,57,40,60,42,43,50,33,35,61,47,53,47,53,65,39,44,45,44,50,48,58,43,53,39,45,36,60,100,100,80,80,80,80,40,80,20,20,60,60,20,20,20,9,Ｃ,過信せず、見通しがつくまで動かない慎重さが本質といえる。思いやりがあり、自分を抑える良さもあるが、問題が起こると自罰的傾向をとり、クヨクヨと取り越し苦労をする傾向がある。どちらかといえば、気弱で引っ込み思案の人である。神経が細かく過敏な性格で、人前にでると緊張し堅くなり、余裕がなくなると多少不安定な行動をとる可能性もある。できるだけ目立たず、隅のほうにいたいという感じで、自信をもった行動力が不足している。一般的には真面目で、一途な人に多くみられるが、ときに、その真面目さが、柔軟性に欠けていると人から見られる。そして、他人との交友関係なども進んでもつほうではなく、関心分野以外のことになると、かかわらないように殻に閉じこもろうとする。よくいえば、自分の内面的な世界の中で審美的な生き方をしているともとれる。ものの見方は客観的で的確に把握しようとする。人情に溺れることなく一歩距離をおいて接するため、冷たい印象を与えることもあるが自分自身については深く内省している。,62,32,30,61,47,41,39,47,49,59,52,0
842,0,２０〜２５才,男,74,41,55,61,59,56,36,61,53,65,51,33,43,26,46,87,55,35,46,56,50,52,49,26,68,51,68,44,62,55,38,61,50,59,41,64,80,80,100,60,100,60,80,60,60,60,100,80,80,80,40,80,-1,Ｃ,落ち着いた雰囲気もあり、何事もはっきりとした見通しがつくまで動かないという慎重さがみられる。また、斬新なアイデアがあるのかもしれないが、その評価の是非を気にするためか、慎重すぎるためか、自分の物差しの中でできる範囲内のことを限定して表現してしまう傾向がある。また、問題が起こると、何事もなかったようにあっさりと流してしまうときと、責任を一人で感じて、いつまでも悩んでしまうようなときとが交互にあらわれる。もう少し、失敗を恐れない図太さがあるとよいが、慎重さ手堅さは評価できる。反面、思いたったことは素早く実行するなど、ポジティブな行動をとることもできる。やや思索性に欠けるきらいがあるが、環境が変っても柔軟に適応することができ、体を動かして物事を解決しようとする。そして、情緒的にも安定していて、一定のリズムをもって生活している。発想も感覚的な部分はあるが、堅実で筋道をたてた理詰めな考え方をすることができる。もっと良い特性を前面に出せばリーダー格になりうる人である。,38,64,71,51,37,70,47,55,51,41,49,0
843,0,２０〜２５才,男,90,41,55,64,29,78,44,55,41,69,46,47,47,34,46,74,66,56,82,59,66,59,53,36,71,41,64,58,57,65,64,68,72,63,64,69,100,100,100,100,100,100,100,100,100,100,100,100,100,100,80,80,18,Ａ,単調な作業であっても、飽きずに長時間こなせる持続性がある。努力と忍耐をもって、目標に向かっていくといった傾向がある。一事に没頭する徹底性がみられ、人からはそれがしつこいと思われることもあるほどで、夢中になると他のことには目がいかなくなるところがある。几帳面だが、ガンコで堅物との印象もあり、社会の秩序を乱す行動は慎み、通俗的な道徳観の持ち主で、物事の判断もそれに沿ったものになる。とはいえ、規則やしきたりにこだわりすぎるというわけではなく、いつも普通の人でありたいと思う願望が常識的な行動をとらせている。また、状況を鵜呑みにせず、先が見えるまでアクションを起こさないという慎重さも本質のひとつである。感情を抑え、落ち着いた雰囲気で信頼される。しかし、問題が起こったりすると、小さなミスでもいつまでも気にかけたり、他の人はとっくに忘れてしまうような失敗を、いつまでも忘れられず悩んだりするところもある。できることだけを小さくまとめるため、思いきった積極的な行動はしない。,63,78,74,67,62,85,55,66,70,39,62,0
