281,0,２０才未満,男,80,65,59,33,42,59,58,55,23,65,62,43,53,53,46,53,55,44,61,47,69,47,53,50,57,59,45,54,47,55,52,57,57,52,64,44,60,80,60,80,40,60,100,20,100,80,60,100,80,60,20,80,9,Ｃ,空想癖があり、自分の殻にこもってしまうことがある。それは自己の内面的世界で遊び、美的な生き方をしているあらわれでもある。独自な価値観の持ち主であるといえ、自分を含めて環境を客観的にとらえる傾向が強く、物事をあるがままに把握しようとする。性格的にうつる印象として、やや暗いという感じも受けるが、自分自身について深く内省していて、よく話をしてみると、その豊かな内面性を垣間見ることができる。また、過信することなく、石橋を叩いて渡るような慎重性が本質といえる。思いやりがあり自分をおさえる良さがあるのだが、自分でどうしようもない問題が起こると必要以上に自分の責任を背負い、くよくよと取り越し苦労するといった気弱で引っ込み思案な面もある。神経が細かく過敏なため、人前では緊張してしまうことがあり、快活に振る舞ことをあまり得意としない。そして、気持ちに余裕がなくなってしまうと、多少不安定な行動をとる可能性もある。一般的にはまじめで一途な人に多いが、柔軟性に欠け大らかさがない。,60,50,56,57,46,53,44,51,54,50,51,0
282,0,２０〜２５才,男,42,61,63,46,59,69,40,61,71,53,39,52,43,30,40,70,52,40,66,56,56,52,41,39,65,57,60,48,51,60,55,57,57,56,52,47,60,100,100,80,100,80,100,100,60,40,100,80,60,100,60,60,-5,Ｃ,積極性があり、外向的であるといえるが、自分の存在を強くアピールする言動が目立ち性格も勝気といえる。本人は特に意識はしていないが、ライバルが登場したりすると、競争的になったりもし、予想以上の能力を発揮することがある。もともと理論的に正しいと思ったことだけ信じるほうだが、自分に間違いがないと思ったことは、相手が誰であろうと議論することができ、意思をつらぬこうとする。自分に自信があるためか、自尊心は高いほうである。また、一方では道徳的なことを大切にする几帳面なところもある。生活ぶりもわりと規則正しく、物事の取り組み方もコツコツと丹念に実行していくような息の長いところもある。物事の判断の仕方も世間一般にそった考え方をするところがあり、常識的な判断をすることができる。しかし、その徹底性も自分で納得のいくものに限られ、感覚的に気に入らなければソッポをむいてしまう。周囲から模範的に見られたいと望んでいるが、自分とリズムが合わなかったりすると見下した態度をとる可能性がある。,38,56,51,53,37,55,43,53,61,39,47,0
283,0,２０〜２５才,男,42,61,63,46,59,69,40,61,71,53,39,52,43,30,40,70,52,40,66,56,56,52,41,39,65,57,60,48,51,60,55,57,57,56,52,47,60,100,100,80,100,80,100,100,60,40,100,80,60,100,60,60,-5,Ｃ,積極性があり、外向的であるといえるが、自分の存在を強くアピールする言動が目立ち性格も勝気といえる。本人は特に意識はしていないが、ライバルが登場したりすると、競争的になったりもし、予想以上の能力を発揮することがある。もともと理論的に正しいと思ったことだけ信じるほうだが、自分に間違いがないと思ったことは、相手が誰であろうと議論することができ、意思をつらぬこうとする。自分に自信があるためか、自尊心は高いほうである。また、一方では道徳的なことを大切にする几帳面なところもある。生活ぶりもわりと規則正しく、物事の取り組み方もコツコツと丹念に実行していくような息の長いところもある。物事の判断の仕方も世間一般にそった考え方をするところがあり、常識的な判断をすることができる。しかし、その徹底性も自分で納得のいくものに限られ、感覚的に気に入らなければソッポをむいてしまう。周囲から模範的に見られたいと望んでいるが、自分とリズムが合わなかったりすると見下した態度をとる可能性がある。,38,56,51,53,37,55,43,53,61,39,47,0
284,0,２０〜２５才,男,34,58,42,49,50,42,44,55,41,73,59,29,67,42,55,41,43,40,42,44,41,43,49,52,51,54,64,37,57,52,47,64,53,42,45,52,80,80,40,100,80,100,60,80,60,60,60,80,80,80,40,60,2,Ｄ,過信せず、見通しがつくまで動かない慎重さがこの人の本質である。思いやりがあり、自分をおさえる良さがあるが、問題がおこると自罰的傾向をとり、くよくよと取り越し苦労する面も。気弱で引っ込み思案の人である。自分に自信がなく、快活な面がみられない。神経が細かく過敏な性格で、人前では緊張してかたくなりがちである。余裕がなくなると、多少不安定な行動をとる可能性もでる。一般的にはまじめで一途な人が多いが、柔軟性に欠けおおらかさがない。,40,35,39,39,31,36,44,52,44,54,48,0
285,0,２０〜２５才,男,70,41,50,54,50,63,48,44,41,57,42,66,47,30,46,46,59,61,66,53,53,67,53,52,50,41,64,62,60,60,52,68,72,46,56,61,80,100,100,80,80,100,100,60,80,60,60,80,60,80,60,60,13,Ａ,単調な作業であっても、飽きずに長時間こなせる持続性がある。努力と忍耐をもって、目標に向かっていくといった傾向がある。一事に没頭する徹底性がみられ、人からはそれがしつこいと思われることもあるほどで、夢中になると他のことには目がいかなくなるところがある。几帳面だが、ガンコで堅物との印象もあり、社会の秩序を乱す行動は慎み、通俗的な道徳観の持ち主で、物事の判断もそれに沿ったものになる。とはいえ、規則やしきたりにこだわりすぎるというわけではなく、いつも普通の人でありたいと思う願望が常識的な行動をとらせている。また、状況を鵜呑みにせず、先が見えるまでアクションを起こさないという慎重さも本質のひとつである。感情を抑え、落ち着いた雰囲気で信頼される。しかし、問題が起こったりすると、小さなミスでもいつまでも気にかけたり、他の人はとっくに忘れてしまうような失敗を、いつまでも忘れられず悩んだりするところもある。できることだけを小さくまとめるため、思いきった積極的な行動はしない。,63,66,68,57,69,64,59,60,63,51,57,0
286,0,２０〜２５才,女,85,41,59,58,50,63,32,53,58,53,49,29,50,38,52,74,59,56,55,53,59,67,45,39,57,47,60,54,60,57,44,64,61,59,64,61,100,80,60,100,80,60,100,80,80,80,60,80,80,60,60,80,1,Ｂ,どちらかといえば、性格的な派手さはなく地味なほうだといえる。一度はじめたことは時間がかかっても途中で投げ出すことはなく、持続させていくことができる。努力を信条としていて、自分が納得いくまで取り組まないと気がすまない性分であり、何事も徹底的に追求しようとする。そして、自分なりに確たる信念や社会通念を持っているのだが、規則や秩序に対して頑固にこだわるというほどではない。発想は堅苦しいものばかりではなく、ユニークさも持ちあわせていて、独自の価値観のもとで自発的、自主的な組立をして考え判断する。また、思い立ったらすぐ実行に移すという身軽さより、物事は自分の納得がいくまでじっくりと考えてから行動する。決して自己の世界に閉じこもり暗いという印象はなく、社会性も持ちあわせている。交友関係もほどほどにあり、考え方も現実的で自分なりに社会的アンテナも張っている。自分を深く内省していて、豊かな内面性をもっている。そして、客観的なものの見方ができ、正確に状況を把握しようとする。,51,68,64,57,52,72,55,57,57,40,52,0
287,0,２０〜２５才,女,34,65,47,43,42,48,36,41,37,50,49,47,60,50,46,53,46,40,55,44,50,43,53,39,51,38,52,33,45,50,41,39,53,49,49,47,80,80,60,100,80,80,40,100,100,100,80,100,80,80,20,80,5,Ｄ,周囲の雑音をあまり気にせず、ときに時間を忘れたように何かを空想しているような傾向が見られる。内面的な世界の中で自己表現をすることで、喜びを感じているようである。そして、自らが進んで行動することは少ないものの、情報の収集のためのアンテナは用意している。物事の把握のしかたは客観的であり、結果と経過の両方を大切にする。自分自身についても深く内省していて、客体化した態度をとろうとする。そのためか、人から見ると本音がわかりづらいという印象があり、多少、冷たい感じを受けることがあるが、実のところ、思いやりや自分の感情を抑える良さがあり、豊かな内面性をそなえている。また、明確な見通しがつくまで動かないという慎重なところもある。しかし、その慎重性は、自分の理想があるのに対して、無理のないところで妥協してしまうこともあり、善し悪しというところである。大きな失敗をしないことはひとつの取り柄ではあるが、あれこれと考えすぎる前に、もう少し思いきった行動をとるような姿勢がほしい。,39,28,28,42,38,33,40,50,50,50,54,0
288,0,２０〜２５才,男,21,54,63,43,47,48,44,53,53,57,46,40,47,26,46,83,62,40,61,70,50,43,57,43,57,44,55,41,54,52,55,35,68,49,45,52,60,80,60,60,80,40,100,100,80,40,100,60,100,60,60,40,4,Ｃ,いろいろな人の集まる輪のなかで、自分から話をするというのではなく、聞き上手な方にまわり、自分のための情報収集をするタイプ。しかし、自分にあった環境や、同じような価値観の持主、気の合った仲間のなかでは、豊かな内面性を自ら積極的に発揮させる。また、独自の内面的世界を重要視していて、周囲のことはあまり気にしないという面がある。しかし、一般的に言われる他人への気配りは見られ、社会への関心はある。どちらかといえば、物事をさめた眼でみつめる方であり、環境をあるがままに客観的にとらえようとしていて、意見の口外は少ないにせよ、頭のなかではじっくりと考えた的確な判断をしている。また、自信がもてるまで、行動に移さない慎重性も認められる。これは、自ら外にうってでるような冒険や果敢な行動をしないための結果といえる。おおきな失敗をしない手堅さとしては評価できるのだが、逆に失敗に対する不安を考えすぎる傾向もあり、良いものがあるのに、できることだけを小さく表現してしまう欠点でもある。,49,48,42,57,45,57,41,58,58,47,60,0
289,0,２０〜２５才,男,81,61,38,46,38,56,51,41,32,73,65,50,47,34,46,53,37,22,66,38,34,32,53,50,50,51,45,30,50,36,52,31,42,42,30,42,40,80,100,40,60,60,60,40,60,40,40,60,60,60,20,80,13,Ｄ,過信せず、見通しがつくまで動かない慎重さがこの人の本質である。思いやりがあり、自分をおさえる良さがあるが、問題がおこると自罰的傾向をとり、くよくよと取り越し苦労する面も。気弱で引っ込み思案の人である。自分に自信がなく、快活な面がみられない。神経が細かく過敏な性格で、人前では緊張してかたくなりがちである。余裕がなくなると、多少不安定な行動をとる可能性もでる。一般的にはまじめで一途な人が多いが、柔軟性に欠けおおらかさがない。,54,22,30,48,41,29,37,44,47,59,48,0
290,0,２０〜２５才,男,86,71,50,33,33,63,71,35,37,65,65,69,53,53,43,32,30,31,61,31,44,25,53,69,28,41,52,30,39,43,61,50,34,35,41,42,60,80,80,60,80,80,40,40,60,60,20,60,60,40,40,60,13,Ｃ,周囲に距離を置いて眺めようとする性格で、観察が客観的であり、私情を交えない判断方法は、あまり間違いを生じることがない。このため大きな失敗をしないことが、ひとつの取り柄といえる。どちらかというと内閉的であり、あまり自分から進んで人との接触をもとめたりはしない。もともと、自分以外の外側のことについて関心がうすいのだが、かわりに自分自身をよく理解していて豊かな内面性を持っている。また、規則やきまりを大切にし、何事においても真面目なところがある。手掛け始めたことは長続きさせる努力性が認められ、丹念に取り組んでいくような物事に向いている。生活や行動において極端な派手さはなく、あまり目立つようなことは得意としない。しかし、一つのことにあくまでも固執しすぎて、しつこさとしてうつることもある。世間のきまりや常識を大切にするあまり、融通がきかない、堅物との印象を他人に与えてしまうことがある。また、自分らしさを主張するより、社会が自分をどう見ているかのほうを気にかけている。,66,26,32,57,55,29,33,44,44,65,48,0
291,0,２０〜２５才,女,70,51,50,49,50,59,44,48,50,78,57,43,43,34,58,66,49,61,61,34,59,59,36,52,47,50,45,51,45,46,58,64,44,49,64,57,60,80,80,100,60,100,100,60,100,60,40,80,40,60,40,80,5,Ｃ,時期尚早なことは決してせず、あくまでも機が熟すのを待つような慎重さがある。自分の感情を抑えるよさがあり、人に対する気配りもみられる。しかし、他人の思惑を考えすぎたり、行動する前から問題が起こることを予測するような気の弱さを表に出すことがあり、そうしたことも見方によっては、自信のなさからきているものだと誤解をまねくことがある。もともと、過敏な神経の持ち主であり、大勢の人の集まる場所では、緊張のため快活に振舞えなくなることがある。持っている冷静さを失うと、不安定な行動をとる可能性もある。一般的に真面目で一途な人に多いが、もう少し精神的に余裕をもてるような、おおらかさがほしい。また、任されたことは単純な作業であっても、飽きずに長時間こなせる持続性がある。通常は何事もコツコツと丹念に取り組むほうで、生活ぶりも規則正しく、几帳面である。努力を信条とし、いつまでも走り続ける長距離ランナー型といえる。しかし、一時に没頭しすぎるきらいがあり、しつこさとして映ることもある。,67,43,43,56,62,45,54,46,51,48,42,0
292,0,２０〜２５才,男,54,48,63,58,50,66,48,53,41,73,57,29,60,50,43,62,69,70,82,47,76,73,36,36,51,57,60,70,51,50,58,68,65,52,76,64,100,100,100,100,100,100,100,100,100,100,100,100,100,100,100,100,13,Ｂ,時期尚早なことは決してせず、あくまでも機が熟すのを待つような慎重さがある。自分の感情を抑えるよさがあり、人に対する気配りもみられる。しかし、他人の思惑を考えすぎたり、行動する前から問題が起こることを予測するような気の弱さを表に出すことがあり、そうしたことも見方によっては、自信のなさからきているものだと誤解をまねくことがある。もともと、過敏な神経の持ち主であり、大勢の人の集まる場所では、緊張のため快活に振舞えなくなることがある。持っている冷静さを失うと、不安定な行動をとる可能性もある。一般的に真面目で一途な人に多いが、もう少し精神的に余裕をもてるような、おおらかさがほしい。また、任されたことは単純な作業であっても、飽きずに長時間こなせる持続性がある。通常は何事もコツコツと丹念に取り組むほうで、生活ぶりも規則正しく、几帳面である。努力を信条とし、いつまでも走り続ける長距離ランナー型といえる。しかし、一時に没頭しすぎるきらいがあり、しつこさとして映ることもある。,67,59,54,67,67,67,60,56,65,43,48,0
293,0,２０〜２５才,男,61,45,38,58,47,45,40,38,41,34,37,50,57,46,40,53,66,65,46,63,59,50,65,50,44,38,55,54,51,50,41,43,68,39,56,69,80,100,80,80,80,60,100,60,80,80,60,80,80,80,80,80,11,Ｃ,身が軽く思いたったことを素早く実行に移すことができる。行動はテキパキしていて、体を動かして物事を解決していく人である。また、環境への適応力があり、状況の変化にたやすくついていけ、実際的な職務遂行に適材である。多少、思索性に欠けるのがやや難。行動的であるが情緒的にもわりあい安定しており、そうリズムが揺れる生活ぶりではない。ときには手がけた仕事を途中で放りだすといった気分屋的な所があるが、現実的発想もできる。感覚的な部分もあるものの、キチンと理詰めな考え方もできる。,49,54,44,51,61,56,57,59,57,54,62,0
294,0,２０〜２５才,女,32,48,71,51,59,50,48,55,53,61,49,36,47,38,55,62,59,56,42,59,72,50,41,58,50,51,79,44,66,55,38,47,65,49,67,57,100,100,100,100,100,100,100,20,100,100,20,100,100,80,80,80,-1,Ｃ,いろいろな人の集まる輪のなかで、自分から話をするというのではなく、聞き上手な方にまわり、自分のための情報収集をするタイプ。しかし、自分にあった環境や、同じような価値観の持主、気の合った仲間のなかでは、豊かな内面性を自ら積極的に発揮させる。また、独自の内面的世界を重要視していて、周囲のことはあまり気にしないという面がある。しかし、一般的に言われる他人への気配りは見られ、社会への関心はある。どちらかといえば、物事をさめた眼でみつめる方であり、環境をあるがままに客観的にとらえようとしていて、意見の口外は少ないにせよ、頭のなかではじっくりと考えた的確な判断をしている。また、自信がもてるまで、行動に移さない慎重性も認められる。これは、自ら外にうってでるような冒険や果敢な行動をしないための結果といえる。おおきな失敗をしない手堅さとしては評価できるのだが、逆に失敗に対する不安を考えすぎる傾向もあり、良いものがあるのに、できることだけを小さく表現してしまう欠点でもある。,45,61,59,52,50,63,46,59,53,47,51,0
295,0,２０〜２５才,女,68,48,47,46,47,69,58,53,41,73,51,40,33,34,55,66,62,56,66,53,66,63,45,46,59,44,55,62,51,63,58,54,76,56,64,57,80,100,100,100,80,80,100,80,100,100,100,100,80,60,60,40,12,Ａ,他の人がなんと言おうと自分で確信がもてるまで、決して行動には移さない慎重なところがある。軽はずみな行動は少なく、落ち着いた雰囲気と信頼感がある。また、努力を信条とし、何事も丹念に取り組んでいこうとする。出だしはそれほどでもないが、いつまでも持続させることができる。生活ぶりもキチンとしていて、物事は計画書を書いて実行するようなマメな人である。しかし、あくまでも一つのことに執着する頑固さではなく融通性も持っている。それほど規則や秩序を気にするわけでなく、状況に応じた判断ができる。世間の常識はわきまえていても、四角四面で固定的なものでなく、よき社会人として模範的な見方をされる。しかし、慎重であるがゆえ、問題が起こると必要以上に自分を責めることがある。その後は二度と同じ失敗をしないように考えすぎて、行動は控えめになることがある。もう少し、図太さがあり積極的にうってでるところがあると安心して見ていられるリーダーになる。しかし、手堅さや慎重さなど評価できる部分は多い。,73,70,66,65,70,69,57,59,64,45,56,0
296,0,２０〜２５才,男,80,71,55,33,54,56,51,48,37,73,71,50,43,42,43,70,49,31,66,41,62,43,32,32,59,62,64,33,45,38,52,54,53,52,52,47,60,100,100,40,80,60,80,80,100,60,80,80,80,60,40,80,3,Ｄ,過信せず、見通しがつくまで動かない慎重さが本質といえる。思いやりがあり、自分を抑える良さもあるが、問題が起こると自罰的傾向をとり、クヨクヨと取り越し苦労をする傾向がある。どちらかといえば、気弱で引っ込み思案の人である。神経が細かく過敏な性格で、人前にでると緊張し堅くなり、余裕がなくなると多少不安定な行動をとる可能性もある。できるだけ目立たず、隅のほうにいたいという感じで、自信をもった行動力が不足している。一般的には真面目で、一途な人に多くみられるが、ときに、その真面目さが、柔軟性に欠けていると人から見られる。そして、他人との交友関係なども進んでもつほうではなく、関心分野以外のことになると、かかわらないように殻に閉じこもろうとする。よくいえば、自分の内面的な世界の中で審美的な生き方をしているともとれる。ものの見方は客観的で的確に把握しようとする。人情に溺れることなく一歩距離をおいて接するため、冷たい印象を与えることもあるが自分自身については深く内省している。,48,31,38,56,39,44,36,48,50,46,42,0
297,0,２０〜２５才,女,47,61,38,33,47,48,55,48,45,61,54,40,43,42,40,74,37,31,46,44,34,32,65,52,42,41,49,30,41,33,44,31,48,42,30,36,20,60,60,60,40,40,60,40,60,20,20,40,40,40,60,60,6,Ｅ,周囲の雑音をあまり気にせず、ときに時間を忘れたように何かを空想しているような傾向が見られる。内面的な世界の中で自己表現をすることで、喜びを感じているようである。そして、自らが進んで行動することは少ないものの、情報の収集のためのアンテナは用意している。物事の把握のしかたは客観的であり、結果と経過の両方を大切にする。自分自身についても深く内省していて、客体化した態度をとろうとする。そのためか、人から見ると本音がわかりづらいという印象があり、多少、冷たい感じを受けることがあるが、実のところ、思いやりや自分の感情を抑える良さがあり、豊かな内面性をそなえている。また、明確な見通しがつくまで動かないという慎重なところもある。しかし、その慎重性は、自分の理想があるのに対して、無理のないところで妥協してしまうこともあり、善し悪しというところである。大きな失敗をしないことはひとつの取り柄ではあるが、あれこれと考えすぎる前に、もう少し思いきった行動をとるような姿勢がほしい。,45,19,23,42,36,24,38,43,45,58,53,0
298,0,２０〜２５才,女,92,45,47,49,47,56,40,50,58,47,30,56,40,30,61,50,57,48,51,67,56,63,53,50,51,36,55,51,51,55,44,54,53,52,56,54,60,100,100,100,100,100,80,80,60,60,60,80,60,60,20,60,2,Ｃ,どちらかといえば、積極性もあり勝気な面があるが、むき出しの競争心ではなく、むしろ、ぎすぎすした人間関係になるのであれば、自分が目立つより協調していたいと思っている。でもそれは、煩わしい人間関係を避けるための自己防衛方法で、肝心なことに直接かかわることは望まないことのあらわれである。しかし、内面では、他人からの評価を気にしていて、周囲から認められたい、評価されたいと感じている。また、ルーズな人間や、いい加減な人をみたりすると我慢ができなくなる。やや気位が高く自尊心を満たす事で生きているともいえ、時に自分勝手な発言をする可能性がある。そして、褒められるとその気になり調子に乗ってしまうあどけない面もある。また、地味とはいえないが、わりと堅い生活を送っている人で、几帳面な一面も持っている。物事の取り組み方も丹念であり、瞬発力はそれほどないが、息切れがせずいつまでも走りつづける徹底性がある。しかし、いつまでもひとつの事に固守するような頑固さはなく、わりと融通がきく。,48,48,54,43,53,52,54,56,57,46,58,0
